[
  {
    "id": "review-001",
    "bookId": "book-001",
    "userId": "user-123",
    "userName": "Ana García",
    "rating": 5,
    "title": "¡Obra maestra de la fantasía!",
    "comment": "Una historia increíble que te atrapa desde la primera página. La construcción del mundo de la Tierra Media es simplemente perfecta. Los personajes están muy bien desarrollados y la narrativa es envolvente.",
    "helpful": 45,
    "verified": true,
    "createdAt": "2024-12-20T14:23:00Z",
    "updatedAt": "2024-12-20T14:23:00Z"
  },
  {
    "id": "review-002",
    "bookId": "book-001",
    "userId": "user-456",
    "userName": "Carlos Ruiz",
    "rating": 4,
    "title": "Excelente, pero un poco lento al principio",
    "comment": "Me encantó la historia y los personajes, pero debo admitir que el inicio es un poco lento. Una vez que arranca la acción, es imposible dejar de leer. Totalmente recomendado para amantes de la fantasía.",
    "helpful": 28,
    "verified": true,
    "createdAt": "2024-12-18T09:15:00Z",
    "updatedAt": "2024-12-18T09:15:00Z"
  },
  {
    "id": "review-003",
    "bookId": "book-001",
    "userId": "user-789",
    "userName": "María López",
    "rating": 5,
    "title": "Un clásico que todos deberían leer",
    "comment": "Este libro me hizo redescubrir mi amor por la lectura. La forma en que Tolkien crea todo un universo con idiomas, historia y geografía propias es impresionante. No por nada es considerado el padre de la fantasía moderna.",
    "helpful": 67,
    "verified": false,
    "createdAt": "2024-12-15T16:42:00Z",
    "updatedAt": "2024-12-15T16:42:00Z"
  },
  {
    "id": "review-004",
    "bookId": "book-003",
    "userId": "user-234",
    "userName": "Roberto Sánchez",
    "rating": 5,
    "title": "Magistral obra del realismo mágico",
    "comment": "García Márquez nos transporta a Macondo con una narrativa única. La historia de los Buendía es fascinante y la forma en que entrelaza lo cotidiano con lo fantástico es simplemente genial. Una lectura obligatoria.",
    "helpful": 89,
    "verified": true,
    "createdAt": "2024-12-10T11:30:00Z",
    "updatedAt": "2024-12-10T11:30:00Z"
  },
  {
    "id": "review-005",
    "bookId": "book-003",
    "userId": "user-567",
    "userName": "Laura Martínez",
    "rating": 4,
    "title": "Complejo pero maravilloso",
    "comment": "Necesité un árbol genealógico para seguir a todos los personajes, pero valió totalmente la pena. La prosa de García Márquez es hermosa y la historia es cautivadora. Un libro que te hace reflexionar sobre la vida y el tiempo.",
    "helpful": 52,
    "verified": true,
    "createdAt": "2024-12-08T15:20:00Z",
    "updatedAt": "2024-12-08T15:20:00Z"
  },
  {
    "id": "review-006",
    "bookId": "book-004",
    "userId": "user-890",
    "userName": "Diego Fernández",
    "rating": 5,
    "title": "Perturbadoramente relevante hoy en día",
    "comment": "Escrito en 1949, pero parece que Orwell estaba prediciendo nuestro futuro. La vigilancia, la manipulación de la información, el control del pensamiento... Todo está aquí. Un libro que da miedo por lo real que se siente.",
    "helpful": 134,
    "verified": true,
    "createdAt": "2024-12-05T13:45:00Z",
    "updatedAt": "2024-12-05T13:45:00Z"
  },
  {
    "id": "review-007",
    "bookId": "book-004",
    "userId": "user-345",
    "userName": "Patricia Gómez",
    "rating": 5,
    "title": "Lectura obligatoria",
    "comment": "Este libro debería ser lectura obligatoria en todas las escuelas. La visión distópica de Orwell es escalofriante y nos hace valorar la libertad que tenemos. Un clásico que nunca pierde vigencia.",
    "helpful": 98,
    "verified": false,
    "createdAt": "2024-12-03T10:12:00Z",
    "updatedAt": "2024-12-03T10:12:00Z"
  },
  {
    "id": "review-008",
    "bookId": "book-006",
    "userId": "user-678",
    "userName": "Javier Herrera",
    "rating": 4,
    "title": "Entretenido y adictivo",
    "comment": "Un thriller muy bien construido que mezcla historia, arte y misterio. Aunque algunas teorías son controvertidas, la narrativa es tan ágil que no puedes dejar de leer. Perfecto para un fin de semana.",
    "helpful": 72,
    "verified": true,
    "createdAt": "2024-11-28T19:30:00Z",
    "updatedAt": "2024-11-28T19:30:00Z"
  },
  {
    "id": "review-009",
    "bookId": "book-008",
    "userId": "user-901",
    "userName": "Sofía Ramírez",
    "rating": 5,
    "title": "Perfecto para todas las edades",
    "comment": "Leí este libro de niña y ahora de adulta. Es increíble cómo funciona a cualquier edad. Bilbo es un personaje entrañable y su aventura es emocionante. La puerta perfecta para entrar al mundo de la Tierra Media.",
    "helpful": 56,
    "verified": true,
    "createdAt": "2024-11-25T14:50:00Z",
    "updatedAt": "2024-11-25T14:50:00Z"
  },
  {
    "id": "review-010",
    "bookId": "book-009",
    "userId": "user-234",
    "userName": "Elena Torres",
    "rating": 5,
    "title": "Romance clásico que nunca envejece",
    "comment": "La relación entre Elizabeth y Darcy es simplemente perfecta. Jane Austen escribió personajes tan reales y complejos que es imposible no enamorarse de la historia. Un clásico atemporal del romance.",
    "helpful": 81,
    "verified": true,
    "createdAt": "2024-11-20T12:15:00Z",
    "updatedAt": "2024-11-20T12:15:00Z"
  },
  {
    "id": "review-011",
    "bookId": "book-010",
    "userId": "user-567",
    "userName": "Miguel Ángel Vargas",
    "rating": 4,
    "title": "Largo pero vale la pena",
    "comment": "Es un libro extenso y requiere paciencia, pero la riqueza literaria y el humor son incomparables. Don Quijote y Sancho Panza forman una de las duplas más memorables de la literatura. Una joya de Cervantes.",
    "helpful": 43,
    "verified": false,
    "createdAt": "2024-11-15T16:40:00Z",
    "updatedAt": "2024-11-15T16:40:00Z"
  }
]
